{
  "id": "push-pull-legs-6day",
  "name": "Push/Pull/Legs (6 days/week)",
  "split": "push-pull-legs",
  "days_per_week": 6,
  "experience_level": [
    "advanced"
  ],
  "target_population": "Advanced lifters who recover well and can commit to 6 sessions, wanting high per-muscle weekly volume at ~2x frequency. Run Push/Pull/Legs twice through.",
  "progression_ref": "rir-autoregulation",
  "sessions": [
    {
      "name": "Push",
      "exercises": [
        {
          "exercise": "barbell-bench-press",
          "sets": 4,
          "rep_range": "6-10",
          "rir": "1-2"
        },
        {
          "exercise": "incline-dumbbell-press",
          "sets": 3,
          "rep_range": "8-12",
          "rir": "1-2"
        },
        {
          "exercise": "machine-chest-press",
          "sets": 3,
          "rep_range": "10-15",
          "rir": "0-1"
        },
        {
          "exercise": "dumbbell-lateral-raise",
          "sets": 4,
          "rep_range": "12-20",
          "rir": "0-1"
        },
        {
          "exercise": "overhead-cable-triceps-extension",
          "sets": 3,
          "rep_range": "10-15",
          "rir": "0-1"
        },
        {
          "exercise": "triceps-pushdown",
          "sets": 3,
          "rep_range": "10-15",
          "rir": "0-1"
        }
      ]
    },
    {
      "name": "Pull",
      "exercises": [
        {
          "exercise": "lat-pulldown",
          "sets": 4,
          "rep_range": "8-12",
          "rir": "1-2"
        },
        {
          "exercise": "chest-supported-row",
          "sets": 4,
          "rep_range": "8-12",
          "rir": "1-2"
        },
        {
          "exercise": "seated-cable-row",
          "sets": 3,
          "rep_range": "10-15",
          "rir": "0-1"
        },
        {
          "exercise": "reverse-pec-deck",
          "sets": 3,
          "rep_range": "12-20",
          "rir": "0-1"
        },
        {
          "exercise": "incline-dumbbell-curl",
          "sets": 3,
          "rep_range": "8-12",
          "rir": "0-1"
        },
        {
          "exercise": "hammer-curl",
          "sets": 2,
          "rep_range": "10-15",
          "rir": "0-1"
        }
      ]
    },
    {
      "name": "Legs",
      "exercises": [
        {
          "exercise": "barbell-back-squat",
          "sets": 4,
          "rep_range": "6-10",
          "rir": "1-2"
        },
        {
          "exercise": "romanian-deadlift",
          "sets": 3,
          "rep_range": "6-10",
          "rir": "1-2"
        },
        {
          "exercise": "leg-press",
          "sets": 3,
          "rep_range": "10-15",
          "rir": "0-1"
        },
        {
          "exercise": "seated-leg-curl",
          "sets": 3,
          "rep_range": "8-12",
          "rir": "0-1"
        },
        {
          "exercise": "leg-extension",
          "sets": 3,
          "rep_range": "12-20",
          "rir": "0-1"
        },
        {
          "exercise": "standing-calf-raise",
          "sets": 4,
          "rep_range": "8-15",
          "rir": "0-1"
        }
      ]
    }
  ],
  "citations": [
    "schoenfeld-2019-volume-trained-men",
    "schoenfeld-2019-frequency-meta"
  ]
}
